{
  "schema_version": 1,
  "name": "deep-clements-hume",
  "version": "1.0.0",
  "description": "Deeper variant of Clements & Hume (1995) feature geometry with 4 effective depth levels",
  "reference": "Clements, G.N. & Hume, E.V. (1995). The internal organization of speech sounds.",
  "weight_presets": {
    "ignore-tone": {
      "Tonal": 0.0
    },
    "ignore-prosodic": {
      "Prosodic": 0.0
    },
    "segmental": {
      "Tonal": 0.0,
      "Prosodic": 0.0
    },
    "tone-heavy": {
      "Tonal": 2.0
    },
    "tone-only": {
      "Laryngeal": 0.0,
      "Manner": 0.0,
      "Place": 0.0,
      "TongueRoot": 0.0,
      "Prosodic": 0.0
    },
    "flat": "__flat__"
  },
  "feature_to_node": {
    "advanced-tongue-root": "TongueRoot",
    "affricate": "ObstruentManner",
    "alveolar": "Coronal",
    "alveolo-palatal": "Coronal",
    "approximant": "SonorantManner",
    "aspirated": "Laryngeal",
    "back": "Dorsal",
    "bilabial": "Labial",
    "breathy": "Laryngeal",
    "central": "Dorsal",
    "click": "ObstruentManner",
    "close": "Dorsal",
    "close-mid": "Dorsal",
    "creaky": "Laryngeal",
    "dental": "Coronal",
    "ejective": "Prosodic",
    "epiglottal": "Pharyngeal",
    "fricative": "ObstruentManner",
    "front": "Dorsal",
    "glottal": "Glottal",
    "glottalized": "Laryngeal",
    "implosive": "ObstruentManner",
    "labial": "Labial",
    "labialized": "Prosodic",
    "labio-dental": "Labial",
    "labio-palatal": "Labial",
    "labio-velar": "Labial",
    "lateral": "SonorantManner",
    "linguolabial": "Coronal",
    "long": "Prosodic",
    "mid": "Dorsal",
    "nasal": "SonorantManner",
    "nasalized": "Prosodic",
    "near-back": "Dorsal",
    "near-close": "Dorsal",
    "near-front": "Dorsal",
    "near-open": "Dorsal",
    "non-pulmonic": "ObstruentManner",
    "non-syllabic": "Manner",
    "open": "Dorsal",
    "open-mid": "Dorsal",
    "palatal": "Dorsal",
    "palatal-velar": "Dorsal",
    "palatalized": "Prosodic",
    "pharyngeal": "Pharyngeal",
    "pharyngealized": "Prosodic",
    "post-alveolar": "Coronal",
    "primary-stress": "Prosodic",
    "retracted-tongue-root": "TongueRoot",
    "retroflex": "Coronal",
    "rounded": "Labial",
    "sibilant": "ObstruentManner",
    "stop": "ObstruentManner",
    "syllabic": "Manner",
    "tap": "SonorantManner",
    "tone-mid-lower": "TonalMid",
    "tone-mid-lowered": "TonalMid",
    "tone-mid-raised": "TonalMid",
    "tone-mid-upper": "TonalMid",
    "tone-offset-lower": "TonalOffset",
    "tone-offset-lowered": "TonalOffset",
    "tone-offset-raised": "TonalOffset",
    "tone-offset-upper": "TonalOffset",
    "tone-onset-lower": "TonalOnset",
    "tone-onset-lowered": "TonalOnset",
    "tone-onset-raised": "TonalOnset",
    "tone-onset-upper": "TonalOnset",
    "trill": "SonorantManner",
    "unrounded": "Labial",
    "uvular": "Dorsal",
    "velar": "Dorsal",
    "voiced": "Laryngeal",
    "voiceless": "Laryngeal"
  },
  "tree": {
    "name": "Root",
    "children": [
      {
        "name": "Laryngeal",
        "children": [
          {
            "name": "voice",
            "positive": "voiced",
            "negative": "voiceless"
          },
          {
            "name": "spread_glottis",
            "positive": "aspirated",
            "negative": ""
          },
          {
            "name": "constricted_glottis",
            "positive": "glottalized",
            "negative": ""
          },
          {
            "name": "breathy_voice",
            "positive": "breathy",
            "negative": ""
          },
          {
            "name": "creaky_voice",
            "positive": "creaky",
            "negative": ""
          }
        ]
      },
      {
        "name": "Manner",
        "children": [
          {
            "name": "sonorant",
            "positive": "sonorant",
            "negative": "obstruent"
          },
          {
            "name": "syllabic",
            "positive": "syllabic",
            "negative": "non-syllabic"
          },
          {
            "name": "ObstruentManner",
            "children": [
              {
                "name": "continuant",
                "positive": "continuant",
                "negative": ""
              },
              {
                "name": "strident",
                "positive": "sibilant",
                "negative": ""
              },
              {
                "name": "delayed_release",
                "positive": "affricate",
                "negative": ""
              },
              {
                "name": "airstream",
                "positive": "non-pulmonic",
                "negative": ""
              }
            ]
          },
          {
            "name": "SonorantManner",
            "children": [
              {
                "name": "nasal",
                "positive": "nasal",
                "negative": ""
              },
              {
                "name": "lateral",
                "positive": "lateral",
                "negative": ""
              },
              {
                "name": "tap_feature",
                "positive": "tap",
                "negative": ""
              }
            ]
          }
        ]
      },
      {
        "name": "Place",
        "children": [
          {
            "name": "Labial",
            "children": [
              {
                "name": "round",
                "positive": "rounded",
                "negative": "unrounded"
              },
              {
                "name": "LabialPlace",
                "children": [
                  {
                    "name": "bilabial_place",
                    "positive": "place.bilabial",
                    "negative": ""
                  },
                  {
                    "name": "labial_place",
                    "positive": "place.labial",
                    "negative": ""
                  },
                  {
                    "name": "labiodental_place",
                    "positive": "place.labio-dental",
                    "negative": ""
                  },
                  {
                    "name": "labiopalatal_place",
                    "positive": "place.labio-palatal",
                    "negative": ""
                  },
                  {
                    "name": "labiovelar_place",
                    "positive": "place.labio-velar",
                    "negative": ""
                  }
                ]
              }
            ]
          },
          {
            "name": "Coronal",
            "children": [
              {
                "name": "anterior",
                "positive": "anterior",
                "negative": ""
              },
              {
                "name": "distributed",
                "positive": "distributed",
                "negative": ""
              },
              {
                "name": "CoronalPlace",
                "children": [
                  {
                    "name": "dental_place",
                    "positive": "place.dental",
                    "negative": ""
                  },
                  {
                    "name": "alveolar_place",
                    "positive": "place.alveolar",
                    "negative": ""
                  },
                  {
                    "name": "postalveolar_place",
                    "positive": "place.post-alveolar",
                    "negative": ""
                  },
                  {
                    "name": "retroflex_place",
                    "positive": "place.retroflex",
                    "negative": ""
                  },
                  {
                    "name": "alveolopalatal_place",
                    "positive": "place.alveolo-palatal",
                    "negative": ""
                  },
                  {
                    "name": "linguolabial_place",
                    "positive": "place.linguolabial",
                    "negative": ""
                  }
                ]
              }
            ]
          },
          {
            "name": "Dorsal",
            "children": [
              {
                "name": "high",
                "positive": "close",
                "negative": "open"
              },
              {
                "name": "low",
                "positive": "near-open",
                "negative": "near-close"
              },
              {
                "name": "back",
                "positive": "back",
                "negative": "front"
              },
              {
                "name": "DorsalPlace",
                "children": [
                  {
                    "name": "velar_place",
                    "positive": "place.velar",
                    "negative": ""
                  },
                  {
                    "name": "uvular_place",
                    "positive": "place.uvular",
                    "negative": ""
                  },
                  {
                    "name": "palatal_place",
                    "positive": "place.palatal",
                    "negative": ""
                  },
                  {
                    "name": "palatalvelar_place",
                    "positive": "place.palatal-velar",
                    "negative": ""
                  }
                ]
              }
            ]
          },
          {
            "name": "Pharyngeal",
            "children": [
              {
                "name": "pharyngeal_place",
                "positive": "pharyngeal",
                "negative": ""
              },
              {
                "name": "epiglottal_place",
                "positive": "epiglottal",
                "negative": ""
              }
            ]
          },
          {
            "name": "Glottal",
            "children": [
              {
                "name": "glottal_place",
                "positive": "glottal",